<?xml version="1.0"?>

<!--
  Copyright (C) Maxim Dounin
  Copyright (C) Nginx, Inc.
  -->

<!DOCTYPE module SYSTEM "../../../../dtd/module.dtd">

<module name="ngx_http_gunzip_module模块"
        link="/cn/docs/http/ngx_http_gunzip_module.html"
        lang="cn"
        translator="nigelzeng"
        rev="1">

<section id="summary">

<para>
<literal>ngx_http_gunzip_module</literal>模块是一个过滤器，
它为不支持“gzip”编码方法的客户端解压具有“<literal>Content-Encoding: gzip</literal>”头的响应。
当希望存储压缩后的数据以节省空间和减少I/O开销，又不希望对那些不支持gzip压缩的客户端造成不利影响时，
此模块会派上用途。
</para>

<para>
这个模块默认不会安装，需要使用<literal>--with-http_gunzip_module</literal>配置参数来启用。
</para>

</section>


<section id="example" name="配置实例">

<para>
<example>
location /storage/ {
    gunzip on;
    ...
}
</example>
</para>

</section>


<section id="directives" name="指令">

<directive name="gunzip">
<syntax><literal>on</literal> | <literal>off</literal></syntax>
<default>off</default>
<context>http</context>
<context>server</context>
<context>location</context>

<para>
针对缺少gzip支持的客户端，启用或者禁用解压经过gzip压缩的响应。
如果启用，也需要考虑以下指令以确定客户端是否支持gzip：
<link doc="ngx_http_gzip_module.xml" id="gzip_http_version">gzip_http_version</link>，
<link doc="ngx_http_gzip_module.xml" id="gzip_proxied">gzip_proxied</link>，
和<link doc="ngx_http_gzip_module.xml" id="gzip_disable">gzip_disable</link>，
另请参阅<link doc="ngx_http_gzip_module.xml" id="gzip_vary">gzip_vary</link>指令。
</para>

</directive>


<directive name="gunzip_buffers">
<syntax><value>number</value> <value>size</value></syntax>
<default>32 4k|16 8k</default>
<context>http</context>
<context>server</context>
<context>location</context>

<para>
设置用于解压一个响应的缓存数和大小。默认的缓存大小等于一个内存页大小。
该值为4K或者8K，取决于具体系统平台。
</para>

</directive>

</section>

</module>
